name,modrinth,curseforge,description
,Q1vvjJYV,322506,"Pakiet shaderów dla gry Minecraft: Java Edition. Jest jasno, kolorowo i niepowtarzalnie."
,dEAKT8y9,345953,"Pakiet shaderów, który sprawia, że ​​jest to tak proste, jak to możliwe, ale nadal dodaje dynamiczne cienie i zachowuje oryginalne renderowanie w jak największym stopniu."
,PYhc7nNa,338898,"Shadery zaprojektowane tak, aby idealnie łączyć naturę i fantazję."
,UaS8ROxa,602290,"Niezwykle lekki, z cieniami i odbiciami."
,R6NEzAwj,385587,"Zmień wygląd gry Minecraft dzięki wyjątkowej jakości, szczegółowości i wydajności."
,ygChbn8J,855381,Szybki i wysokiej jakości pakiet shaderów z realistyczną grafiką i atmosferą PBR.
,BS9T99lD,832754,"Prosty moduł cieniujący Java dla Minecrafta, który stara się zachować waniliową estetykę, dodając opcjonalne cienie, kolorowe oświetlenie i śledzenie promieni."
,71EyVfCn,486209,"Moduł cieniujący, który dodaje realizmu i świetnego wyglądu Minecraftowi."
,EpQFjzrQ,678384,Wydajny pakiet shaderów w stylu fantasy z kolorowym oświetleniem i oszałamiającymi efektami wizualnymi.
,sclYVqbt,759541,"Pakiet shaderów, który zwiększa wrażenia dzięki konfigurowalnym ustawieniom i pięknym symulacjom oświetlenia."
,ZvitaqQh,449652,Pakiet shaderów oparty na starszym shaderze Chocapic13.
,Xl42lc6c,669144,Minimalistyczny i wydajny pakiet shaderów do śledzenia promieni.
,ZvMtQlho,610844,"Dobrze działający pakiet shaderów w stylu fantasy, kładący nacisk na zróżnicowanie i dostosowywanie scen."
,LMIZZNxZ,534748,"Pakiet shaderów zaprojektowany tak, aby oddać styl anulowanego pakietu graficznego Super Duper i innych popularnych tytułów Minecraft."
,xEItlMn3,326302,"Uchwyć esencję starszych shaderów, aby uzyskać stylizowany i nowoczesny wygląd Minecrafta."
,,544096,
,sC1oZTSS,920167,Lekki i przyjazny dla gier pakiet shaderów!
,UDDa70lE,363825,Ten pakiet shaderów jest po prostu luźną remake'iem mojego starego SEUS Mod bez użycia żadnego jego kodu.
,WX4iF5Cj,467280,"Bardzo lekki pakiet cieni, ale wciąż wygląda wspaniale na swój sposób."
,Y8161YLz,322270,"Wysokiej jakości, realistyczny, ale także stylizowany pakiet shaderów."
,EPsIYDj1,322360,"Pakiet shaderów, który nadaje grze Minecraft nowoczesny wygląd, zachowując jednocześnie jej oryginalny wygląd."
,HVnmMxH1,627557,"Zachowanie elementów Minecrafta z wyjątkową jakością, szczegółowością i wydajnością."
,izsIPI7a,431203,"Celem MakeUp jest zapewnienie najlepszego stosunku jakości do wydajności, budując moduł cieniujący, który może dostosować się do zasobów każdego użytkownika."
,RphJSnEs,406081,"Wysoce konfigurowalny pakiet shaderów. Jeśli kochasz efekty specjalne, ten pakiet shaderów jest dla Ciebie!"
,EQWX2WiO,618217,"Stylizowany pakiet cieniowania Iris o tematyce horroru, który można w dużym stopniu dostosowywać i który jest wydajny."
,iHC8BZn4,1040578,"Atmosferyczny, wysoce konfigurowalny pakiet shaderów horroru, następca Insanity Shader."
,6uJCfiCH,921717,Straszna zmodyfikowana wersja uzupełniających shaderów.
,by2i3tnt,1093481,Dodano efekt aparatu na ciele.
,w8N6pbsN,758336,"OPAL Shaders to pakiet shaderów Minecraft Java Edition oparty na Shaderach BSL stworzonych przez Capta Tatsu. Został zaprojektowany tak, aby łączyć fantastyczną atmosferę z naturalnymi kolorami i kontrastami, zachowując jednocześnie wierność oryginalnemu stylowi Minecrafta."
,pgzM6RBY,1085570,Pakiet shaderów dla gry Minecraft: Java Edition. Jest nastawiony na oryginalną estetykę.
,BkTdFBUU,813185,"Piękny, wydajny zestaw cieni do pastelowych kolorów z wieloma ustawieniami kolorów."
,CiFGzRV9,969143,"Pakiet shaderów stworzony, by ulepszyć grafikę gry, zachowując waniliowy styl."
,,273654,
,YU49BElv,676136,Prosty shader vanilla plus z odbiciami w przestrzeni ekranu! W wersji alfa!
,sAZ9WsJP,1159841,"Mroczne, napięte shadery, które połaskoczą twoje nerwy."
,e2fAZfFz,1016013,Zapomnij o nudnym wyglądzie waniliowych skrzyń — teraz zyskasz bardziej realistyczne tekstury!
,BUxf36AP,1113130,"Shaderpack o malarskiej estetyce dla osób, które chcą naprawdę grać. Przyjazny dla oczu i komputera!"
,4kHmJd4i,508365,Wydajny shaderpack ze świetną bezcieniową oprawą i obsługą PBR.
,yhuqxlbn,1038016,"Bardzo waniliowy, wydajny shader z aktywnym skalowaniem/filtrowaniem tekstur i opcjonalnymi cieniami. Subtelnie ulepszony waniliowy klimat z możliwością konfiguracji."
,Ah4Q0Hhi,1112674,"Shader sprawiający, że Minecraft renderuje świat wyłącznie znakami ASCII!"
,XaonJnsc,1167228,Retro shader dodający artefakty CRT oraz VCR/VHS.
,LTvf5Tji,1155908,"Edycja shaderów MakeUp - Ultra Fast, wysoce konfigurowalna, piękna i szybka!"
,lLqFfGNs,1110131,"Pakiet shaderów skupiony na rozgrywce, w półrealistycznym stylu."
,1BZ68dI8,1092607,Shader łączący wysoką wydajność z nowymi funkcjami i szerokim zakresem stylów!
,bNFqrJXS,996289,"Prosty, ale bardzo dobry pakiet motion blur o niskim wpływie na wydajność, ulepszający waniliowe wrażenia!"
,7eXucZxq,331780,Waniliowy Minecraft z odrobiną dodatków!
,D5k8BTVz,883885,Poprawia oprawę wizualną bez przeszkadzania w rozgrywce.
,BWnGghPW,1058040,Dodaje shader efektów telewizora VHS i nie tylko.
,tLyAc6iV,1086316,"Stylizowany shader, który nadaje grze retro wygląd!"
,Kqx96bgP,914435,"Energy Shaders dla Java. Waniliowy shaderpack Minecrafta, który zwiększa żywiołowość i estetykę gry, nadając jej zupełnie nowy styl. Nie wymaga Optifine/Iris!"
,hgAKxFQg,1078762,"Oparty na Complimentary Unbound, pięknie kolorowy shader Vanilla+, który poprawia wygląd gry, zachowując dobrą wydajność i waniliowy klimat."
,5aFJgbak,1091924,Dodaje Motion Blur w Minecraft.
,HpOC6pyc,665460,Shadery stworzone z myślą o pięknie.
,SvynK6FG,1109406,Zamienia świat w zimę.